{
  "$schema": "https://json-schema.org/draft/2020-12/schema",
  "title": "review-artifact",
  "description": "独立レビュー（Sol 等）の成果物。コミットメッセージでの Go 記録を禁止し、対象コミットと成果物 digest に束縛する（クロージャー §8）。G-REVIEW-BINDING が検証する。",
  "type": "object",
  "additionalProperties": false,
  "required": [
    "review_id",
    "reviewer_principal",
    "model",
    "target_commit",
    "target_tree",
    "reviewed_artifact_digests",
    "findings",
    "resolution_commits",
    "verdict",
    "completed_at",
    "rounds",
    "separation_status"
  ],
  "properties": {
    "review_id": {
      "type": "string",
      "pattern": "^REV-[A-Z0-9-]+$"
    },
    "reviewer_principal": {
      "type": "string",
      "minLength": 3,
      "description": "レビュー主体（実装者と別 principal であること）"
    },
    "author_principal": {
      "type": "string",
      "minLength": 3,
      "description": "被レビュー成果物の作成主体。reviewer_principal と異なることを G-REVIEW-SEPARATION が検査する"
    },
    "author_execution_id": {
      "type": "string",
      "minLength": 8,
      "description": "作成側の実行 ID（作業セッション識別子）。reviewer_execution_id と一致してはならない"
    },
    "reviewer_execution_id": {
      "type": "string",
      "minLength": 8,
      "description": "レビュー側の実行 ID（レビュアのセッション識別子）。review_log_digest が指すログの中に実在すること"
    },
    "review_run_id": {
      "type": "string",
      "minLength": 4,
      "description": "レビュー実行の一意 ID（ラウンドを跨ぐ 1 レビューの実行単位）"
    },
    "reviewer_provider": {
      "type": "string",
      "minLength": 3,
      "description": "レビュー実行基盤（例: openai-codex-cli）。作成側と別基盤であることを示す"
    },
    "review_log_path": {
      "type": "string",
      "pattern": "^docs/00-authority/reviews/logs/[A-Za-z0-9._-]+$",
      "description": "レビュー実行ログの実体（リポジトリ内。clone 先でも digest を検証できる位置に置く）"
    },
    "review_log_digest": {
      "type": "string",
      "pattern": "^[0-9a-f]{16}$",
      "description": "review_log_path の sha256[:16]。実在ログと一致しなければ separation_status=verified を名乗れない"
    },
    "separation_status": {
      "type": "string",
      "enum": [
        "verified",
        "unverified"
      ],
      "description": "verified = 主体分離が実行証跡で確認済み。unverified = 証跡を取得できず『独立レビュー済み』と宣言しない（PO 判断へ送る）"
    },
    "model": {
      "type": "string",
      "minLength": 3
    },
    "target_commit": {
      "type": "string",
      "pattern": "^[0-9a-f]{40}$",
      "description": "レビュー対象の凍結コミット（full sha）"
    },
    "reviewed_artifact_digests": {
      "type": "object",
      "minProperties": 1,
      "additionalProperties": {
        "type": "string",
        "pattern": "^[0-9a-f]{16}$"
      },
      "description": "レビュー時点の成果物 sha256[:16]。レビュー後の改変を G-REVIEW-BINDING が検出する"
    },
    "findings": {
      "type": "array",
      "items": {
        "type": "object",
        "additionalProperties": false,
        "required": [
          "severity",
          "summary",
          "status"
        ],
        "properties": {
          "severity": {
            "type": "string",
            "enum": [
              "blocker",
              "major",
              "minor"
            ]
          },
          "summary": {
            "type": "string",
            "minLength": 10
          },
          "status": {
            "type": "string",
            "enum": [
              "resolved",
              "accepted-as-is",
              "deferred"
            ]
          },
          "resolution": {
            "type": "string",
            "minLength": 6
          },
          "deferred_to": {
            "type": "string",
            "minLength": 2
          }
        }
      }
    },
    "resolution_commits": {
      "type": "array",
      "items": {
        "type": "string",
        "pattern": "^[0-9a-f]{7,40}$"
      },
      "description": "是正コミット（findings に status=resolved がある場合は 1 件以上必須 — G-REVIEW-BINDING が検査）"
    },
    "verdict": {
      "type": "string",
      "enum": [
        "Go",
        "No-Go"
      ]
    },
    "completed_at": {
      "type": "string",
      "pattern": "^[0-9]{4}-[0-9]{2}-[0-9]{2}"
    },
    "rounds": {
      "type": "integer",
      "minimum": 1,
      "description": "No-Go→是正→再レビューの往復回数"
    },
    "scope": {
      "type": "string",
      "minLength": 4,
      "description": "レビュー範囲（S0 設計クロージャー等）"
    },
    "supersedes_review": {
      "type": "array",
      "items": {
        "type": "string",
        "pattern": "^REV-[A-Z0-9-]+$"
      },
      "description": "本レビューが引き継ぐ先行レビュー ID。物理移行・是正で成果物内容が変わった場合、先行 Go の束縛はここで明示的に引き継ぐ（G-REVIEW-BINDING が chain を辿る）"
    },
    "target_tree": {
      "type": "string",
      "pattern": "^[0-9a-f]{40}$",
      "description": "レビュー対象コミットのルートツリー sha。`git rev-parse <target_commit>^{tree}` と厳密一致でなければならない（dangling tree は push されず clone 先で解決できない）。"
    }
  }
}
