{
  "review_id": "REV-S0-STRUCT-02",
  "reviewer_principal": "codex-sol（分離は実行証跡で未確認 — separation_status: unverified）",
  "separation_status": "unverified",
  "model": "gpt-5.6-sol",
  "target_commit": "403e7260ffeb6e5734eec3f6753ecd0e97d06604",
  "target_tree": "b7df9e033bb76da3d3ee2b6d958daf4a3e7c67d1",
  "scope": "REV-S0-STRUCT-01 の束縛機構自身に見つかった欠陥の是正 — `target_tree` に `git write-tree` の dangling tree を用いており、push されないため CI の clone 先で 解決できず GitHub Actions が両ワークフローとも失敗した。束縛先を到達可能なコミットの ツリーへ付け替え、同じ穴を G-REVIEW-BINDING で検出できるようにした。束縛対象は変更した 2 ファイル（review_binding.py・test_review_binding.py）のみ。REV-S0-STRUCT-01 が束縛する他の 29 件は内容不変であり、本レビューが supersedes_review で引き継ぐ",
  "reviewed_artifact_digests": {
    "tools/gates/review_binding.py": "e2fd9944f8529199",
    "tests/gates/test_review_binding.py": "67b3504f89a23b90"
  },
  "findings": [
    {
      "severity": "major",
      "status": "resolved",
      "summary": "target_tree に git write-tree の dangling tree を用いたため、push されず CI の clone 先で解決できずローカルだけ緑になっていた（PR #1 の両ワークフローが失敗）",
      "resolution": "束縛先を実コミット 2f3b0b3e のルートツリー bb219bdb へ付け替え。束縛対象 31 件のバイト同一性を実測で確認（旧凍結比・新束縛比とも不一致 0 件）"
    },
    {
      "severity": "major",
      "status": "resolved",
      "summary": "到達不能な target_tree をゲートが検出できず、ローカル緑・CI 赤の乖離を許していた",
      "resolution": "tree_is_reachable() と is_committed() を追加し、レビュー成果物がコミット済みなら target_tree はコミットから到達可能であることを G-REVIEW-BINDING で要求。回帰テスト 3 本を追加"
    },
    {
      "severity": "minor",
      "status": "deferred",
      "summary": "target_tree が target_commit のツリーであることは検査されず、両フィールドが不整合でも通る（target_commit が事実上の装飾フィールドになりうる）",
      "deferred_to": "次サイクル（tree_is_reachable を `git rev-parse <target_commit>^{tree}` との O(1) 等値比較へ置換。到達可能性検査を包含し、--all の ref 依存も同時に解消する）"
    },
    {
      "severity": "minor",
      "status": "deferred",
      "summary": "tree_is_reachable が `git log --all` の ref 可用性に暗黙依存する（detached HEAD は --all に含まれない。現状は両ワークフローの fetch-depth: 0 で成立）",
      "deferred_to": "次サイクル（上記の rev-parse 等値比較へ移行すれば依存自体が消える）"
    },
    {
      "severity": "minor",
      "status": "deferred",
      "summary": "レビュー成果物が未コミットの間は到達可能性を検査しないため、ローカル緑と CI 緑の乖離が小規模に再生産される（免除自体は運用上必要）",
      "deferred_to": "次サイクル（免除適用時にゲート出力へ『未コミットのため未検査 — コミット後に CI が検査する』の注記を加える）"
    }
  ],
  "resolution_commits": [
    "2f3b0b3e332a466fbc20ad7fd2aaba3042784c02",
    "403e7260ffeb6e5734eec3f6753ecd0e97d06604"
  ],
  "verdict": "Go",
  "rounds": 7,
  "completed_at": "2026-08-01",
  "supersedes_review": [
    "REV-S0-STRUCT-01"
  ]
}
